{
  "schemaVersion": 1,
  "project": "BeansPetGame",
  "manifestRoot": "manifests",
  "sourceRoot": "src",
  "buildRoot": "build",
  "manifests": [
    "manifests/ui/core.json",
    "manifests/scenes/common.json",
    "manifests/props/gameplay.json",
    "manifests/characters/triceratops.json"
  ],
  "targets": {
    "runtime_bundles": {
      "type": "runtime_bundle",
      "outDir": "build/runtime"
    }
  }
}
